{
  "schema_version": "1",
  "id": "python-probe-optimized",
  "kind": "binding_probe",
  "command": [
    "${PYTHON_RUNTIME}/bin/python3.12",
    "-O",
    "${SOURCE}/bindings/python_probe/probe.py",
    "${SOURCE}/stage/df0-corrections-suite-v1/lib/libdicomflux_probe.dylib",
    "--budgets",
    "${SOURCE}/docs/architecture/qualification-budgets.json"
  ],
  "cwd": "${SOURCE}",
  "started_at": "2026-10-05T06:54:31.520789+00:00",
  "elapsed_seconds": 0.09960849999333732,
  "exit_code": 0,
  "outcome": "passed",
  "build_source_digest": "c15bd156852496d1469f5e71f937c0f036afdaeaefb9e66ea662a1457b338e0d",
  "stdout": "{\"kind\": \"foundation_probe\", \"python_optimize\": 1, \"python\": \"3.12.14 (main, Aug 25 2026, 13:50:33) [Clang 22.1.3 ]\", \"machine\": \"arm64\", \"abi_options_size\": 80, \"abi_options_alignment\": 8, \"load_call_gc_explicit_close_double_wrapper_close_invalid_options\": \"passed\", \"engine_writer_tests\": \"not_run; no engine writer implemented\"}\n",
  "stderr": "",
  "scope": "DF-0 prototype only"
}
