{
  "schema_version": "1",
  "id": "resource-observation",
  "kind": "resource_measurement",
  "command": [
    "${PYTHON_RUNTIME}/bin/python3.12",
    "${SOURCE}/tools/measure_probe_resources.py",
    "${SOURCE}/build/df0-corrections-suite-v1-host/df0_unit"
  ],
  "cwd": "${SOURCE}",
  "started_at": "2026-10-05T06:54:32.694962+00:00",
  "elapsed_seconds": 0.03905024999403395,
  "exit_code": 0,
  "outcome": "passed",
  "build_source_digest": "c15bd156852496d1469f5e71f937c0f036afdaeaefb9e66ea662a1457b338e0d",
  "stdout": "{\"kind\": \"resource_measurement\", \"scope\": \"one foundation-test process; not a writer benchmark\", \"command\": [\"${SOURCE}/build/df0-corrections-suite-v1-host/df0_unit\"], \"exit_code\": 0, \"elapsed_seconds\": 0.005059834016719833, \"peak_process_rss_bytes\": 2162688, \"user_seconds\": 0.001003, \"system_seconds\": 0.0021219999999999998, \"stdout\": \"DF0 prototype checks=89 allocation_sites=2 fault_modes=2 concurrent_measurements=4000 tracked_bytes=65648\\n\", \"stderr\": \"\", \"limitations\": \"RSS includes runtime/test process; library tracked peak is reported separately by the probe. Single run, cache state uncontrolled; no throughput comparison.\"}\n",
  "stderr": "",
  "scope": "DF-0 prototype only"
}
