{
  "schema_version": "1",
  "id": "python-version",
  "kind": "compile_link_probe",
  "command": [
    "${PYTHON_RUNTIME}/bin/python3.12",
    "--version"
  ],
  "cwd": "${SOURCE}",
  "started_at": "2026-10-05T08:14:13.761412+00:00",
  "elapsed_seconds": 0.007740500004729256,
  "exit_code": 0,
  "outcome": "passed",
  "build_source_digest": "a0256778d37e1a52f0d5c3ec1acb62e177b330f9cee957e9bff3b8c41a824f35",
  "stdout": "Python 3.12.14\n",
  "stderr": "",
  "scope": "DF-0 prototype only"
}
