{
  "schema_version": "1",
  "id": "fuzz-longer",
  "kind": "coverage_guided_fuzz",
  "command": [
    "${SOURCE}/build/df0-fuzz/df0_fuzz",
    "${SOURCE}/build/df0-fuzz-corpus",
    "-seed=20261005",
    "-max_total_time=30",
    "-max_len=64",
    "-print_final_stats=1"
  ],
  "cwd": "${SOURCE}",
  "started_at": "2026-10-04T18:06:46.207948+00:00",
  "elapsed_seconds": 31.055443625009502,
  "exit_code": 0,
  "outcome": "passed",
  "stdout": "",
  "stderr": "INFO: Running with entropic power schedule (0xFF, 100).\nINFO: Seed: 20261005\nINFO: Loaded 2 modules   (174 inline 8-bit counters): 100 [0x1025bc000, 0x1025bc064), 74 [0x10253c000, 0x10253c04a), \nINFO: Loaded 2 PC tables (174 PCs): 100 [0x1025bc068,0x1025bc6a8), 74 [0x10253c050,0x10253c4f0), \nINFO:       17 files found in ${SOURCE}/build/df0-fuzz-corpus\nINFO: seed corpus: files: 17 min: 1b max: 32b total: 513b rss: 44Mb\n#18\tINITED cov: 109 ft: 119 corp: 13/385b exec/s: 0 rss: 45Mb\n#2097152\tpulse  cov: 109 ft: 119 corp: 13/385b lim: 64 exec/s: 699050 rss: 152Mb\n#4194304\tpulse  cov: 109 ft: 119 corp: 13/385b lim: 64 exec/s: 599186 rss: 152Mb\n#8388608\tpulse  cov: 109 ft: 119 corp: 13/385b lim: 64 exec/s: 599186 rss: 152Mb\n#16777216\tpulse  cov: 109 ft: 119 corp: 13/385b lim: 64 exec/s: 578524 rss: 152Mb\n#17873133\tDONE   cov: 109 ft: 119 corp: 13/385b lim: 64 exec/s: 576552 rss: 152Mb\nDone 17873133 runs in 31 second(s)\nstat::number_of_executed_units: 17873133\nstat::average_exec_per_sec:     576552\nstat::new_units_added:          0\nstat::slowest_unit_time_sec:    0\nstat::peak_rss_mb:              152\n",
  "scope": "DF-0 prototype only"
}
