{
  "schema_version": "1",
  "id": "resource-corrected",
  "kind": "resource_measurement",
  "command": [
    "${PYTHON_RUNTIME}/bin/python3",
    "${SOURCE}/tools/measure_probe_resources.py",
    "${SOURCE}/build/df0-host/df0_unit"
  ],
  "cwd": "${SESSION}",
  "started_at": "2026-10-04T18:19:49.405888+00:00",
  "elapsed_seconds": 0.06679225000000001,
  "exit_code": 0,
  "outcome": "passed",
  "stdout": "{\"kind\": \"resource_measurement\", \"scope\": \"one foundation-test process; not a writer benchmark\", \"command\": [\"${SOURCE}/build/df0-host/df0_unit\"], \"exit_code\": 0, \"elapsed_seconds\": 0.0070905409957049415, \"peak_process_rss_bytes\": 2162688, \"user_seconds\": 0.0010069999999999999, \"system_seconds\": 0.002596, \"stdout\": \"DF0 prototype checks=89 allocation_sites=2 fault_modes=2 concurrent_measurements=4000 tracked_bytes=65648\\n\", \"stderr\": \"\", \"limitations\": \"RSS includes runtime/test process; library tracked peak is reported separately by the probe. Single run, cache state uncontrolled; no throughput comparison.\"}\n",
  "stderr": "",
  "scope": "DF-0 prototype only",
  "build_source_digest": "f7926ec54e91a074a2fe405a7f9aa2b7e2b4b73432b5ce5d2c4d9bf0080040f6"
}
