{
  "schema_version": "1",
  "id": "undefined-unit",
  "kind": "foundation_test",
  "command": [
    "${PRIVATE_WORK}/tooling/cmake/data/bin/ctest",
    "--test-dir",
    "${SOURCE}/build/df0-undefined",
    "--verbose",
    "--output-on-failure"
  ],
  "cwd": "${SOURCE}",
  "started_at": "2026-10-04T17:57:29.959256+00:00",
  "elapsed_seconds": 1.0341013750003185,
  "exit_code": 0,
  "outcome": "passed",
  "stdout": "UpdateCTestConfiguration  from :${SOURCE}/build/df0-undefined/DartConfiguration.tcl\nParse Config file:${SOURCE}/build/df0-undefined/DartConfiguration.tcl\nTest project ${SOURCE}/build/df0-undefined\nConstructing a list of tests\nDone constructing a list of tests\nUpdating test list for fixtures\nAdded 0 tests to meet fixture requirements\nChecking test dependency graph...\nChecking test dependency graph end\ntest 1\n    Start 1: df0_foundation\n\n1: Test command: ${SOURCE}/build/df0-undefined/df0_unit\n1: Working Directory: ${SOURCE}/build/df0-undefined\n1: Test timeout computed to be: 1500\n1: DF0 prototype checks=88 allocation_sites=2 fault_modes=2 concurrent_measurements=4000 tracked_bytes=65648\n1/1 Test #1: df0_foundation ...................   Passed    1.02 sec\n\n100% tests passed out of 1\n\nTotal Test time (real) =   1.02 sec\n",
  "stderr": "",
  "scope": "DF-0 prototype only"
}
