{
  "schema_version": "1",
  "id": "fuzz-short",
  "kind": "coverage_guided_fuzz",
  "command": [
    "${SOURCE}/build/df0-fuzz/df0_fuzz",
    "${SOURCE}/build/df0-fuzz-corpus",
    "-seed=20261004",
    "-max_total_time=10",
    "-max_len=64",
    "-print_final_stats=1"
  ],
  "cwd": "${SOURCE}",
  "started_at": "2026-10-04T18:06:34.326552+00:00",
  "elapsed_seconds": 11.88078479100659,
  "exit_code": 0,
  "outcome": "passed",
  "stdout": "",
  "stderr": "INFO: Running with entropic power schedule (0xFF, 100).\nINFO: Seed: 20261004\nINFO: Loaded 2 modules   (174 inline 8-bit counters): 100 [0x1005fc000, 0x1005fc064), 74 [0x10057c000, 0x10057c04a), \nINFO: Loaded 2 PC tables (174 PCs): 100 [0x1005fc068,0x1005fc6a8), 74 [0x10057c050,0x10057c4f0), \nINFO:        6 files found in ${SOURCE}/build/df0-fuzz-corpus\nINFO: seed corpus: files: 6 min: 32b max: 32b total: 192b rss: 43Mb\n#7\tINITED cov: 93 ft: 99 corp: 5/160b exec/s: 0 rss: 44Mb\n#15\tNEW    cov: 94 ft: 100 corp: 6/183b lim: 32 exec/s: 0 rss: 45Mb L: 23/32 MS: 3 CrossOver-ChangeBinInt-CrossOver-\n#66\tNEW    cov: 98 ft: 105 corp: 7/215b lim: 32 exec/s: 0 rss: 45Mb L: 32/32 MS: 1 ShuffleBytes-\n#76\tNEW    cov: 99 ft: 106 corp: 8/247b lim: 32 exec/s: 0 rss: 45Mb L: 32/32 MS: 5 CMP-ChangeBinInt-ChangeBinInt-CrossOver-ChangeBit- DE: \"\\001\\000\"-\n#102\tNEW    cov: 101 ft: 111 corp: 9/279b lim: 32 exec/s: 0 rss: 46Mb L: 32/32 MS: 1 CopyPart-\n#114\tNEW    cov: 102 ft: 112 corp: 10/311b lim: 32 exec/s: 0 rss: 46Mb L: 32/32 MS: 2 CopyPart-ShuffleBytes-\n#167\tNEW    cov: 103 ft: 113 corp: 11/343b lim: 32 exec/s: 0 rss: 47Mb L: 32/32 MS: 3 CopyPart-CopyPart-ChangeBit-\n#175\tNEW    cov: 104 ft: 114 corp: 12/375b lim: 32 exec/s: 0 rss: 47Mb L: 32/32 MS: 3 ChangeBit-ChangeByte-ChangeBinInt-\n#271\tREDUCE cov: 104 ft: 114 corp: 12/367b lim: 32 exec/s: 0 rss: 48Mb L: 15/32 MS: 1 EraseBytes-\n#279\tNEW    cov: 105 ft: 115 corp: 13/399b lim: 32 exec/s: 0 rss: 48Mb L: 32/32 MS: 3 CMP-CrossOver-ChangeBinInt- DE: \"\\005\\000\\000\\000\\000\\000\\000\\000\"-\n#430\tNEW    cov: 106 ft: 116 corp: 14/431b lim: 32 exec/s: 0 rss: 51Mb L: 32/32 MS: 1 ChangeBinInt-\n#552\tREDUCE cov: 106 ft: 116 corp: 14/428b lim: 32 exec/s: 0 rss: 53Mb L: 12/32 MS: 2 InsertByte-EraseBytes-\n#1658\tREDUCE cov: 106 ft: 116 corp: 14/425b lim: 42 exec/s: 0 rss: 71Mb L: 9/32 MS: 1 CrossOver-\n#3414\tREDUCE cov: 106 ft: 116 corp: 14/423b lim: 57 exec/s: 0 rss: 103Mb L: 7/32 MS: 1 EraseBytes-\n#3526\tREDUCE cov: 106 ft: 116 corp: 14/421b lim: 57 exec/s: 0 rss: 105Mb L: 5/32 MS: 2 ChangeBit-EraseBytes-\n#8872\tNEW    cov: 107 ft: 117 corp: 15/466b lim: 64 exec/s: 0 rss: 152Mb L: 45/45 MS: 1 CopyPart-\n#9569\tREDUCE cov: 107 ft: 117 corp: 15/464b lim: 64 exec/s: 0 rss: 152Mb L: 3/45 MS: 2 ShuffleBytes-EraseBytes-\n#13029\tREDUCE cov: 107 ft: 117 corp: 15/463b lim: 64 exec/s: 0 rss: 152Mb L: 2/45 MS: 5 ShuffleBytes-ChangeByte-ChangeBit-ShuffleBytes-EraseBytes-\n#17760\tREDUCE cov: 107 ft: 117 corp: 15/462b lim: 64 exec/s: 0 rss: 152Mb L: 1/45 MS: 1 EraseBytes-\n#18226\tREDUCE cov: 107 ft: 117 corp: 15/461b lim: 64 exec/s: 0 rss: 152Mb L: 44/44 MS: 1 EraseBytes-\n#18479\tREDUCE cov: 107 ft: 117 corp: 15/459b lim: 64 exec/s: 0 rss: 152Mb L: 42/42 MS: 3 InsertByte-ShuffleBytes-EraseBytes-\n#20880\tREDUCE cov: 107 ft: 117 corp: 15/452b lim: 64 exec/s: 0 rss: 152Mb L: 35/35 MS: 1 EraseBytes-\n#20952\tNEW    cov: 109 ft: 119 corp: 16/494b lim: 64 exec/s: 0 rss: 152Mb L: 42/42 MS: 2 ChangeBinInt-InsertRepeatedBytes-\n#26698\tREDUCE cov: 109 ft: 119 corp: 16/492b lim: 64 exec/s: 0 rss: 152Mb L: 33/42 MS: 1 EraseBytes-\n#34969\tREDUCE cov: 109 ft: 119 corp: 16/490b lim: 64 exec/s: 0 rss: 152Mb L: 40/40 MS: 1 EraseBytes-\n#40163\tREDUCE cov: 109 ft: 119 corp: 16/486b lim: 64 exec/s: 0 rss: 152Mb L: 36/36 MS: 4 ChangeBit-CrossOver-InsertRepeatedBytes-CrossOver-\n#46679\tREDUCE cov: 109 ft: 119 corp: 16/485b lim: 64 exec/s: 0 rss: 152Mb L: 32/36 MS: 1 EraseBytes-\n#139470\tREDUCE cov: 109 ft: 119 corp: 16/482b lim: 64 exec/s: 0 rss: 152Mb L: 33/33 MS: 1 CrossOver-\n#322467\tREDUCE cov: 109 ft: 119 corp: 16/481b lim: 64 exec/s: 0 rss: 152Mb L: 32/32 MS: 2 InsertRepeatedBytes-EraseBytes-\n#2097152\tpulse  cov: 109 ft: 119 corp: 16/481b lim: 64 exec/s: 699050 rss: 152Mb\n#4194304\tpulse  cov: 109 ft: 119 corp: 16/481b lim: 64 exec/s: 599186 rss: 152Mb\n#6352608\tDONE   cov: 109 ft: 119 corp: 16/481b lim: 64 exec/s: 577509 rss: 152Mb\n###### Recommended dictionary. ######\n\"\\001\\000\" # Uses: 298744\n\"\\005\\000\\000\\000\\000\\000\\000\\000\" # Uses: 285300\n###### End of recommended dictionary. ######\nDone 6352608 runs in 11 second(s)\nstat::number_of_executed_units: 6352608\nstat::average_exec_per_sec:     577509\nstat::new_units_added:          28\nstat::slowest_unit_time_sec:    0\nstat::peak_rss_mb:              152\n",
  "scope": "DF-0 prototype only"
}
