{
  "schema_version": "1",
  "id": "consumer-configure",
  "kind": "compile_link_probe",
  "command": [
    "${PRIVATE_WORK}/tooling/cmake/data/bin/cmake",
    "-S",
    "${SOURCE}/build/df0-consumer-src",
    "-B",
    "${SOURCE}/build/df0-consumers",
    "-G",
    "Ninja",
    "-DCMAKE_MAKE_PROGRAM=${PRIVATE_WORK}/tooling/ninja-1.13.2.data/scripts/ninja",
    "-DCMAKE_PREFIX_PATH=${SOURCE}/stage/df0",
    "-DCMAKE_FIND_USE_PACKAGE_REGISTRY=OFF"
  ],
  "cwd": "${SOURCE}",
  "started_at": "2026-10-04T17:57:24.251188+00:00",
  "elapsed_seconds": 0.535052082996117,
  "exit_code": 0,
  "outcome": "passed",
  "stdout": "-- The C compiler identification is AppleClang 21.0.0.21000099\n-- The CXX compiler identification is AppleClang 21.0.0.21000099\n-- Detecting C compiler ABI info\n-- Detecting C compiler ABI info - done\n-- Check for working C compiler: /usr/bin/cc - skipped\n-- Detecting C compile features\n-- Detecting C compile features - done\n-- Detecting CXX compiler ABI info\n-- Detecting CXX compiler ABI info - done\n-- Check for working CXX compiler: /usr/bin/c++ - skipped\n-- Detecting CXX compile features\n-- Detecting CXX compile features - done\n-- Configuring done (0.5s)\n-- Generating done (0.0s)\n-- Build files have been written to: ${SOURCE}/build/df0-consumers\n",
  "stderr": "",
  "scope": "DF-0 prototype only"
}
